{
  "schema_version": "1.0",
  "id": "lab-biosafety",
  "title": "Laboratory Safety and Biosafety",
  "description": "Assess biological risk, apply Biosafety Level 1 and 2 practices, select and use biological safety cabinets, decontaminate and sterilize with verification, work safely with human materials and hazardous chemicals, and respond to exposures.",
  "domain": "Life sciences laboratory",
  "level": "Year 1",
  "maturity": "partial",
  "version": "0.1.0",
  "license": "CC-BY-4.0",
  "content_origin": {
    "kind": "original",
    "source_path": null,
    "source_sha256": null,
    "migration_version": null,
    "modifications": [
      "Original readings, worked examples, practice and cards developed with substantial AI assistance on 2026-10-30 and 2026-10-31 as layer 1 of the wet-lab practice track, adapting guidance from BMBL 6th edition and OSHA standards (US federal works) with attribution."
    ]
  },
  "prerequisites": {
    "course_ids": [],
    "recommended_course_ids": [
      "lab-measurement",
      "cell-biology"
    ],
    "concurrent_course_ids": [],
    "knowledge": [
      "Basic microbiology vocabulary"
    ],
    "statement": "Laboratory Measurement and Foundations of Cell and Molecular Biology recommended. This package establishes no university prerequisite equivalency and replaces no institutional safety training."
  },
  "outcomes": [
    {
      "id": "lab-biosafety-outcome-1",
      "description": "Assess biological risk from agent and procedure hazards and choose controls in hierarchy order.",
      "bloom": "evaluate"
    },
    {
      "id": "lab-biosafety-outcome-2",
      "description": "Apply BSL-1 and BSL-2 practices and select, use and verify biological safety cabinets.",
      "bloom": "apply"
    },
    {
      "id": "lab-biosafety-outcome-3",
      "description": "Decontaminate, disinfect and sterilize correctly, and verify that the process worked.",
      "bloom": "apply"
    },
    {
      "id": "lab-biosafety-outcome-4",
      "description": "Work safely with human materials and hazardous chemicals, respond to exposures, and recognise when shipping requires trained personnel.",
      "bloom": "apply"
    }
  ],
  "lesson_objectives": [
    {
      "id": "lab-biosafety-1-objective-1",
      "description": "Distinguish a hazard from a risk and rank tasks with a probability × consequence score.",
      "bloom": "apply",
      "course_outcome_ids": [
        "lab-biosafety-outcome-1"
      ]
    },
    {
      "id": "lab-biosafety-1-objective-2",
      "description": "Identify agent and procedure hazards, including the routes of laboratory-associated infection.",
      "bloom": "analyze",
      "course_outcome_ids": [
        "lab-biosafety-outcome-1"
      ]
    },
    {
      "id": "lab-biosafety-1-objective-3",
      "description": "Apply the hierarchy of controls and distinguish inherent from residual risk.",
      "bloom": "apply",
      "course_outcome_ids": [
        "lab-biosafety-outcome-1"
      ]
    },
    {
      "id": "lab-biosafety-1-objective-4",
      "description": "Carry out the six steps of the BMBL risk management process, including review and revisiting.",
      "bloom": "apply",
      "course_outcome_ids": [
        "lab-biosafety-outcome-1"
      ]
    },
    {
      "id": "lab-biosafety-2-objective-1",
      "description": "Distinguish primary from secondary barriers and explain how practice, equipment and facility combine.",
      "bloom": "understand",
      "course_outcome_ids": [
        "lab-biosafety-outcome-2"
      ]
    },
    {
      "id": "lab-biosafety-2-objective-2",
      "description": "State how BSL-2 differs from BSL-1 and what is posted at a BSL-2 entrance.",
      "bloom": "remember",
      "course_outcome_ids": [
        "lab-biosafety-outcome-2"
      ]
    },
    {
      "id": "lab-biosafety-2-objective-3",
      "description": "Apply BSL-2 standard microbiological practices.",
      "bloom": "apply",
      "course_outcome_ids": [
        "lab-biosafety-outcome-2"
      ]
    },
    {
      "id": "lab-biosafety-2-objective-4",
      "description": "Identify BSL-2 special practices, safety equipment and facilities, and decide when work moves into a cabinet.",
      "bloom": "evaluate",
      "course_outcome_ids": [
        "lab-biosafety-outcome-2"
      ]
    },
    {
      "id": "lab-biosafety-3-objective-1",
      "description": "Distinguish personnel, product and environmental protection across cabinet classes, clean benches and fume hoods.",
      "bloom": "understand",
      "course_outcome_ids": [
        "lab-biosafety-outcome-2"
      ]
    },
    {
      "id": "lab-biosafety-3-objective-2",
      "description": "Describe Class II Types A1, A2, B1 and B2 airflow, inflow velocity and exhaust.",
      "bloom": "understand",
      "course_outcome_ids": [
        "lab-biosafety-outcome-2"
      ]
    },
    {
      "id": "lab-biosafety-3-objective-3",
      "description": "Calculate inflow volume and face velocity, and select a cabinet type for the work.",
      "bloom": "apply",
      "course_outcome_ids": [
        "lab-biosafety-outcome-2"
      ]
    },
    {
      "id": "lab-biosafety-3-objective-4",
      "description": "State certification triggers, the limits of UV lamps and placement effects on containment.",
      "bloom": "remember",
      "course_outcome_ids": [
        "lab-biosafety-outcome-2"
      ]
    },
    {
      "id": "lab-biosafety-4-objective-1",
      "description": "Define cleaning, disinfection, sterilization and decontamination and what each guarantees.",
      "bloom": "understand",
      "course_outcome_ids": [
        "lab-biosafety-outcome-3"
      ]
    },
    {
      "id": "lab-biosafety-4-objective-2",
      "description": "Rank microorganisms by resistance and list the factors that determine disinfection.",
      "bloom": "analyze",
      "course_outcome_ids": [
        "lab-biosafety-outcome-3"
      ]
    },
    {
      "id": "lab-biosafety-4-objective-3",
      "description": "Choose a disinfectant by activity level and prepare a hypochlorite solution of a target concentration.",
      "bloom": "apply",
      "course_outcome_ids": [
        "lab-biosafety-outcome-3"
      ]
    },
    {
      "id": "lab-biosafety-4-objective-4",
      "description": "Relate exposure time to log reduction and sterility assurance with D-values, and describe autoclave verification.",
      "bloom": "apply",
      "course_outcome_ids": [
        "lab-biosafety-outcome-3"
      ]
    },
    {
      "id": "lab-biosafety-5-objective-1",
      "description": "Assess the risk of human and primate cell material and state the minimum containment.",
      "bloom": "evaluate",
      "course_outcome_ids": [
        "lab-biosafety-outcome-4"
      ]
    },
    {
      "id": "lab-biosafety-5-objective-2",
      "description": "Explain universal precautions and the materials the Bloodborne Pathogens Standard covers.",
      "bloom": "understand",
      "course_outcome_ids": [
        "lab-biosafety-outcome-4"
      ]
    },
    {
      "id": "lab-biosafety-5-objective-3",
      "description": "List the employer's obligations under 29 CFR 1910.1030 with their timing.",
      "bloom": "remember",
      "course_outcome_ids": [
        "lab-biosafety-outcome-4"
      ]
    },
    {
      "id": "lab-biosafety-5-objective-4",
      "description": "Carry out the immediate response to a sharps injury or splash and report it at once.",
      "bloom": "apply",
      "course_outcome_ids": [
        "lab-biosafety-outcome-4"
      ]
    },
    {
      "id": "lab-biosafety-6-objective-1",
      "description": "State what a Chemical Hygiene Plan contains, who is responsible and how often it is reviewed.",
      "bloom": "remember",
      "course_outcome_ids": [
        "lab-biosafety-outcome-4"
      ]
    },
    {
      "id": "lab-biosafety-6-objective-2",
      "description": "Read a hazard-communication label, including its six elements and signal words.",
      "bloom": "understand",
      "course_outcome_ids": [
        "lab-biosafety-outcome-4"
      ]
    },
    {
      "id": "lab-biosafety-6-objective-3",
      "description": "Find information on a 16-section safety data sheet.",
      "bloom": "apply",
      "course_outcome_ids": [
        "lab-biosafety-outcome-4"
      ]
    },
    {
      "id": "lab-biosafety-6-objective-4",
      "description": "Distinguish Category A and B infectious substances and describe triple packaging and shipper training.",
      "bloom": "understand",
      "course_outcome_ids": [
        "lab-biosafety-outcome-4"
      ]
    }
  ],
  "duration": {
    "instructional_weeks": 6,
    "equivalent_structure": "Proposed six-week module of one reading and practice set per week, with the cabinet simulation in week 3 and an optional project in week 6. It prepares for, and does not replace, institutional biosafety, bloodborne-pathogen and chemical-hygiene training. The schedule has not been measured or reviewed.",
    "weeks": [
      {
        "week": 1,
        "title": "Biological risk assessment and the hierarchy of controls",
        "lesson_ids": [
          "lab-biosafety-1"
        ],
        "assessment_ids": [
          "lab-biosafety-1-practice"
        ]
      },
      {
        "week": 2,
        "title": "Biosafety Levels 1 and 2: practices, equipment and facilities",
        "lesson_ids": [
          "lab-biosafety-2"
        ],
        "assessment_ids": [
          "lab-biosafety-2-practice"
        ]
      },
      {
        "week": 3,
        "title": "Biological safety cabinets; bench practice: a Class II cabinet session with a spill",
        "lesson_ids": [
          "lab-biosafety-3"
        ],
        "assessment_ids": [
          "lab-biosafety-3-practice"
        ]
      },
      {
        "week": 4,
        "title": "Decontamination, disinfection and sterilization",
        "lesson_ids": [
          "lab-biosafety-4"
        ],
        "assessment_ids": [